{
  "schema_version": "curve.test-strategy-matrix/v2",
  "matrix_id": "P0-05",
  "matrix_version": 2,
  "status": "IN_REVIEW",
  "source": {
    "prd_version": "0.13",
    "document": "docs/curve-ai-native-sdlc-prd.md",
    "section": "Acceptance criteria for R1, the first usable release",
    "acceptance_criteria_digest": "sha256:0115c788d369b6063282a4549ff8fc7b011727be13f6f882b004fd9920b33a20",
    "first_ac": "AC-01",
    "last_ac": "AC-60",
    "ac_count": 60
  },
  "owners": {
    "engineering_owner": "Federico Ocampo, CTO at X3M",
    "human_reviewer": "Federico Ocampo"
  },
  "suites": [
    { "id": "S-UNIT", "name": "Python and TypeScript unit tests", "kind": "UNIT", "repositories": ["PLANE"], "implementation_state": "AVAILABLE", "command_ids": ["CMD-PLANE-API-CURVE", "CMD-PLANE-WEB-UNIT"] },
    { "id": "S-DATABASE", "name": "Django and PostgreSQL persistence tests", "kind": "DATABASE", "repositories": ["PLANE"], "implementation_state": "AVAILABLE", "command_ids": ["CMD-PLANE-API-CURVE"] },
    { "id": "S-CONTRACT", "name": "OpenAPI, JSON Schema, event, and adapter contracts", "kind": "CONTRACT", "repositories": ["CURVE", "PLANE"], "implementation_state": "AVAILABLE", "command_ids": ["CMD-CURVE-CHECK", "CMD-PLANE-API-CURVE"] },
    { "id": "S-FAKE-PROVIDER", "name": "Deterministic provider conformance doubles", "kind": "FAKE_PROVIDER", "repositories": ["PLANE"], "implementation_state": "PLANNED", "command_ids": ["CMD-PROVIDER-CORE-CONFORMANCE", "CMD-KNOWLEDGE-PROVIDER-CONFORMANCE", "CMD-REPOSITORY-DISCOVERY-CONFORMANCE", "CMD-AUTOMATED-EXECUTION-CONFORMANCE", "CMD-ORCA-MCP-CONFORMANCE", "CMD-VCS-MUTATION-CONFORMANCE", "CMD-MODEL-GATEWAY-CONFORMANCE", "CMD-DELIVERY-INTEGRATION-CONFORMANCE"] },
    { "id": "S-TEMPORAL-REPLAY", "name": "Temporal replay and durable-workflow tests", "kind": "TEMPORAL_REPLAY", "repositories": ["PLANE"], "implementation_state": "PARTIAL", "command_ids": ["CMD-PLANE-API-CURVE", "CMD-TEMPORAL-LOCAL"] },
    { "id": "S-COMPONENT", "name": "React component and state-mapping tests", "kind": "COMPONENT", "repositories": ["PLANE"], "implementation_state": "AVAILABLE", "command_ids": ["CMD-PLANE-WEB-UNIT"] },
    { "id": "S-BROWSER-E2E", "name": "Authenticated browser end-to-end tests", "kind": "BROWSER_E2E", "repositories": ["PLANE"], "implementation_state": "PLANNED", "command_ids": ["CMD-BROWSER-E2E"] },
    { "id": "S-ACCESSIBILITY", "name": "Automated and keyboard accessibility tests", "kind": "ACCESSIBILITY", "repositories": ["PLANE"], "implementation_state": "PLANNED", "command_ids": ["CMD-ACCESSIBILITY"] },
    { "id": "S-SECURITY", "name": "Authorization, isolation, injection, and data-leak fixtures", "kind": "SECURITY", "repositories": ["PLANE", "EXTERNAL_HARNESS"], "implementation_state": "PARTIAL", "command_ids": ["CMD-PLANE-API-CURVE", "CMD-GVISOR-SECURITY"] },
    { "id": "S-MIGRATION", "name": "Forward, rollback, and compatibility migration tests", "kind": "MIGRATION", "repositories": ["PLANE"], "implementation_state": "AVAILABLE", "command_ids": ["CMD-PLANE-MIGRATION-CHECK", "CMD-PLANE-API-FULL"] },
    { "id": "S-LOAD", "name": "API, workflow, event-stream, and scheduling load tests", "kind": "LOAD", "repositories": ["EXTERNAL_HARNESS"], "implementation_state": "PLANNED", "command_ids": ["CMD-LOAD"] },
    { "id": "S-CHAOS-RECOVERY", "name": "Dependency disruption, restart, retry, and reconciliation tests", "kind": "CHAOS_RECOVERY", "repositories": ["PLANE", "EXTERNAL_HARNESS"], "implementation_state": "PARTIAL", "command_ids": ["CMD-TEMPORAL-LOCAL", "CMD-RECOVERY-STAGING"] },
    { "id": "S-SANDBOX", "name": "gVisor runner and preview containment tests", "kind": "SANDBOX", "repositories": ["EXTERNAL_HARNESS"], "implementation_state": "PLANNED", "command_ids": ["CMD-GVISOR-SECURITY"] },
    { "id": "S-MANUAL-EVIDENCE", "name": "Attributed human verification with immutable evidence", "kind": "MANUAL_EVIDENCE", "repositories": ["CURVE"], "implementation_state": "PLANNED", "command_ids": ["CMD-MANUAL-EVIDENCE"] },
    { "id": "S-RELEASE-COMPLIANCE", "name": "AGPL, source, SBOM, provenance, and release checks", "kind": "RELEASE_COMPLIANCE", "repositories": ["PLANE"], "implementation_state": "PLANNED", "command_ids": ["CMD-RELEASE-COMPLIANCE"] }
  ],
  "environments": [
    { "id": "E-CURVE-DOCS-CI", "name": "Curve documentation and contract CI", "scope": "DOCUMENTATION_CI", "availability": "AVAILABLE", "data_policy": "SANITIZED_FIXTURES", "owner": "Curve engineering" },
    { "id": "E-PLANE-TEST-CI", "name": "Plane API and PostgreSQL test stack", "scope": "PLANE_CI", "availability": "AVAILABLE", "data_policy": "SYNTHETIC_ONLY", "owner": "Curve engineering" },
    { "id": "E-PLANE-WEB-CI", "name": "Plane web unit and component test runtime", "scope": "PLANE_CI", "availability": "AVAILABLE", "data_policy": "SYNTHETIC_ONLY", "owner": "Curve engineering" },
    { "id": "E-CURVE-LOCAL-COMPOSE", "name": "Curve-enabled Plane Docker Compose stack", "scope": "LOCAL", "availability": "AVAILABLE", "data_policy": "SYNTHETIC_ONLY", "owner": "Developer running the local environment" },
    { "id": "E-BROWSER-LOCAL", "name": "Local authenticated browser harness", "scope": "LOCAL", "availability": "PLANNED", "data_policy": "SYNTHETIC_ONLY", "owner": "Curve engineering" },
    { "id": "E-TEMPORAL-LOCAL", "name": "Local Temporal and Curve worker profile", "scope": "LOCAL", "availability": "AVAILABLE", "data_policy": "SYNTHETIC_ONLY", "owner": "Developer running the local environment" },
    { "id": "E-DISPOSABLE-PROVIDER", "name": "Disposable provider and VCS conformance projects", "scope": "DISPOSABLE_EXTERNAL", "availability": "PLANNED", "data_policy": "SYNTHETIC_ONLY", "owner": "Curve engineering" },
    { "id": "E-GVISOR-STAGING", "name": "Staging gVisor runner and preview pool", "scope": "STAGING", "availability": "DECISION_BLOCKED", "data_policy": "APPROVED_STAGING_DATA", "owner": "Platform Operations" },
    { "id": "E-X3M-STAGING", "name": "X3M staging control plane and approved integrations", "scope": "STAGING", "availability": "DECISION_BLOCKED", "data_policy": "APPROVED_STAGING_DATA", "owner": "Platform Operations" },
    { "id": "E-RELEASE-CI", "name": "Public Plane release compliance pipeline", "scope": "RELEASE_CI", "availability": "PLANNED", "data_policy": "PUBLIC_RELEASE_METADATA", "owner": "Federico Ocampo" }
  ],
  "commands": [
    { "id": "CMD-CURVE-CHECK", "name": "Complete Curve documentation and contract gate", "repository": "CURVE", "state": "AVAILABLE", "working_directory": ".", "command": "pnpm check", "readiness_rule": "Required for every Curve contract or planning change." },
    { "id": "CMD-CURVE-EXTERNAL", "name": "Curve external-link verification", "repository": "CURVE", "state": "AVAILABLE", "working_directory": ".", "command": "pnpm check:external", "readiness_rule": "Required when a changed document adds or changes an external link." },
    { "id": "CMD-PLANE-API-CURVE", "name": "Focused Curve backend suite", "repository": "PLANE", "state": "AVAILABLE", "working_directory": ".", "command": "docker compose -f docker-compose-test.yml run --rm --build api-tests pytest plane/curve/tests", "readiness_rule": "Required for every Curve backend or contract implementation package." },
    { "id": "CMD-PLANE-API-FULL", "name": "Complete Plane backend suite", "repository": "PLANE", "state": "AVAILABLE", "working_directory": ".", "command": "docker compose -f docker-compose-test.yml up --build --abort-on-container-exit --exit-code-from api-tests", "readiness_rule": "Required before accepting a Plane implementation package." },
    { "id": "CMD-PLANE-MIGRATION-CHECK", "name": "Django migration drift check", "repository": "PLANE", "state": "AVAILABLE", "working_directory": ".", "command": "docker compose -f docker-compose-test.yml run --rm api-tests python manage.py makemigrations --check --dry-run", "readiness_rule": "Required for every package that changes persistence or Django models." },
    { "id": "CMD-PLANE-WEB-UNIT", "name": "Plane web Vitest suite", "repository": "PLANE", "state": "AVAILABLE", "working_directory": ".", "command": "pnpm --filter web test", "readiness_rule": "Required for every Curve web component or state-mapping change." },
    { "id": "CMD-PLANE-CHECK", "name": "Plane repository check gate", "repository": "PLANE", "state": "AVAILABLE", "working_directory": ".", "command": "pnpm check", "readiness_rule": "Required for every Plane implementation package." },
    { "id": "CMD-PLANE-BUILD", "name": "Plane production build", "repository": "PLANE", "state": "AVAILABLE", "working_directory": ".", "command": "pnpm build", "readiness_rule": "Required for every user-facing or package-boundary Plane change." },
    { "id": "CMD-TEMPORAL-LOCAL", "name": "Local Temporal workflow and replay suite", "repository": "PLANE", "state": "AVAILABLE", "working_directory": ".", "command": "docker compose -f docker-compose-local.yml -f docker-compose-curve.yml --profile curve exec api pytest plane/curve/tests -k \"workflow or temporal or replay or cancellation\"", "readiness_rule": "Requires the Curve local Compose profile to be running." },
    { "id": "CMD-BROWSER-E2E", "name": "Pinned Playwright end-to-end command", "repository": "PLANE", "state": "PLANNED", "working_directory": null, "command": null, "readiness_rule": "The first browser package must pin the command, browser version or image digest, authentication fixture, trace output, and retry policy before READY." },
    { "id": "CMD-ACCESSIBILITY", "name": "Pinned automated accessibility command", "repository": "PLANE", "state": "PLANNED", "working_directory": null, "command": null, "readiness_rule": "The first accessibility-owning package must pin the runner, ruleset, browser, output format, and keyboard script before READY." },